18:42:14.104475 IP 172.31.2.4 > 192.168.0.109: ICMP echo request, id 49492, seq 49409, length 8
18:42:14.247987 IP 172.31.2.4 > 192.168.0.103: ICMP echo request, id 21845, seq 39169, length 8
18:42:14.316966 IP 192.168.1.1 > 192.168.1.104: ICMP 192.168.1.1 udp port domain unreachable, length 80
18:42:14.318701 IP 192.168.1.1 > 192.168.1.104: ICMP 192.168.1.1 udp port domain unreachable, length 80
18:42:15.104605 IP 172.31.2.4 > 192.168.0.109: ICMP echo request, id 49492, seq 49665, length 8
18:42:15.157616 IP 192.168.1.1 > 192.168.1.104: ICMP 192.168.1.1 udp port domain unreachable, length 64
18:42:15.248098 IP 172.31.2.4 > 192.168.0.103: ICMP echo request, id 21845, seq 39425, length 8
18:42:15.279942 IP 192.168.1.1 > 192.168.1.101: ICMP net 8.8.8.8 unreachable, length 73

